name,rarity,category,uses,recycle_safe,recycle_outputs,notes,sources
Spring Cushion,Rare,Recyclable,"Durable cloth + springs salvage",Yes,"2x Durable Cloth; 2x Steel Spring","High value for cloth/spring farming; safe salvage late","https://arcraiders.wiki/wiki/Loot"
Spotter Relay,Uncommon,Recyclable,"Electrical component salvage; ARC-related",Yes,"2x Electrical Components; 1x ARC Alloy","Useful mid-game; safe salvage once you’re done with spotter-related upgrades","https://arcraiders.wiki/wiki/Loot"
Steel Spring,Uncommon,Topside Material,"Used heavily in Expedition 'Foundation' and Mod Components",Yes,"3x Metal Parts","Important early/mid game; treat as semi-precious for Caravan","https://arcraiders.wiki/wiki/Loot; https://www.escapistmagazine.com/news-hey-dont-recycle-these-arc-raiders-items/"
Surveyor Vault,Rare,Topside Material,"Mechanical + ARC Alloy bundle; rare salvage",Yes,"2x Mechanical Components; 2x ARC Alloy","Good salvage but also appears in some high-end uses; keep a few","https://arcraiders.wiki/wiki/Loot"
Synthesized Fuel,Rare,Topside Material,"Rocket/fuel crafting; used in Rocket Thruster",Yes,"1x Oil; 1x Plastic Parts","Safe salvage resource, but keep enough if you craft thrusters","https://arcraiders.wiki/wiki/Loot"
Syringe,Rare,Topside Material,"Medical-themed crafting, part of Med salvage chains",Yes,"3x Plastic Parts; 2x Chemicals","Useful for medical projects; salvage if overflowing","https://arcraiders.wiki/wiki/Loot"
Tattered ARC Lining,Uncommon,Recyclable,"Fabric salvage",Yes,"12x Fabric","Good late-game fabric source","https://arcraiders.wiki/wiki/Loot"
Tattered Clothes,Uncommon,Recyclable,"Fabric salvage",Yes,"11x Fabric","Safe general salvage","https://arcraiders.wiki/wiki/Loot"
Thermostat,Rare,Recyclable,"Rubber + sensors salvage",Yes,"6x Rubber Parts; 2x Sensors","Nice hybrid salvage; safe after you’re stocked on sensors","https://arcraiders.wiki/wiki/Loot"
Tick Pod,Uncommon,Recyclable,"ARC tick salvage; chem + metal",Yes,"1x Chemicals; 1x Metal Parts","Safe salvage","https://arcraiders.wiki/wiki/Loot"
Toaster,Rare,Recyclable,"Plastic + wires salvage",Yes,"5x Plastic Parts; 3x Wires","Strong electronic scrap; safe salvage","https://arcraiders.wiki/wiki/Loot"
Turbo Pump,Rare,Recyclable,"Mechanical + oil salvage",Yes,"1x Mechanical Components; 3x Oil","High-value mechanical salvage","https://arcraiders.wiki/wiki/Loot"
Unusable Weapon,Rare,Recyclable,"Metal + Simple Gun Parts salvage",Yes,"4x Metal Parts; 5x Simple Gun Parts","Basically a gun-parts piñata; safe salvage","https://arcraiders.wiki/wiki/Loot"
Voltage Converter,Rare,Topside Material,"Used in some electrical chains; drops from Industrial Charger",Yes,"1x Wires; 1x Rubber Parts","Safe salvage once generator/charger-style upgrades are done","https://arcraiders.wiki/wiki/Loot"
Wasp Driver,Rare,Recyclable,"Higher-quality Wasp ARC component",Yes,"1x ARC Alloy; 1x Electrical Components","Useful for Workshop; recycle only surplus","https://arcraiders.wiki/wiki/Loot"
Water Filter,Rare,Recyclable,"Quest/expedition utility item; also good salvage",Yes,"2x Rubber Parts; 3x Canister","Check quests first—then it’s safe recycling material","https://arcraiders.wiki/wiki/Loot"
Water Pump,Rare,Recyclable,"Quest item (appears in some Caravan objectives); salvage",Yes,"4x Metal Parts; 2x Oil","Keep a few for quests; scrap extras","https://arcraiders.wiki/wiki/Loot"
Wires,Uncommon,Topside Material,"Huge Expedition requirement and core in most electronics",Yes,"2x Rubber Parts","Do NOT aggressively recycle early; they’re a bottleneck for Expedition & benches","https://arcraiders.wiki/wiki/Loot; https://www.escapistmagazine.com/news-hey-dont-recycle-these-arc-raiders-items/"
